{
  "name": "ISO 639-1 Language Codes",
  "namespace": "urn:iso:std:iso:639-1",
  "version": "2023",
  "source_url": "https://www.iso.org/iso-639-language-codes.html",
  "source_standard": "ISO 639-1:2002",
  "last_updated": "2024-01-15",
  "domain": "core",
  "is_hierarchical": false,
  "codes": [
    {"code": "aa", "display": "Afar"},
    {"code": "ab", "display": "Abkhazian"},
    {"code": "ae", "display": "Avestan"},
    {"code": "af", "display": "Afrikaans"},
    {"code": "ak", "display": "Akan"},
    {"code": "am", "display": "Amharic"},
    {"code": "an", "display": "Aragonese"},
    {"code": "ar", "display": "Arabic"},
    {"code": "as", "display": "Assamese"},
    {"code": "av", "display": "Avaric"},
    {"code": "ay", "display": "Aymara"},
    {"code": "az", "display": "Azerbaijani"},
    {"code": "ba", "display": "Bashkir"},
    {"code": "be", "display": "Belarusian"},
    {"code": "bg", "display": "Bulgarian"},
    {"code": "bh", "display": "Bihari languages"},
    {"code": "bi", "display": "Bislama"},
    {"code": "bm", "display": "Bambara"},
    {"code": "bn", "display": "Bengali"},
    {"code": "bo", "display": "Tibetan"},
    {"code": "br", "display": "Breton"},
    {"code": "bs", "display": "Bosnian"},
    {"code": "ca", "display": "Catalan"},
    {"code": "ce", "display": "Chechen"},
    {"code": "ch", "display": "Chamorro"},
    {"code": "co", "display": "Corsican"},
    {"code": "cr", "display": "Cree"},
    {"code": "cs", "display": "Czech"},
    {"code": "cu", "display": "Church Slavic"},
    {"code": "cv", "display": "Chuvash"},
    {"code": "cy", "display": "Welsh"},
    {"code": "da", "display": "Danish"},
    {"code": "de", "display": "German"},
    {"code": "dv", "display": "Divehi"},
    {"code": "dz", "display": "Dzongkha"},
    {"code": "ee", "display": "Ewe"},
    {"code": "el", "display": "Greek"},
    {"code": "en", "display": "English"},
    {"code": "eo", "display": "Esperanto"},
    {"code": "es", "display": "Spanish"},
    {"code": "et", "display": "Estonian"},
    {"code": "eu", "display": "Basque"},
    {"code": "fa", "display": "Persian"},
    {"code": "ff", "display": "Fulah"},
    {"code": "fi", "display": "Finnish"},
    {"code": "fj", "display": "Fijian"},
    {"code": "fo", "display": "Faroese"},
    {"code": "fr", "display": "French"},
    {"code": "fy", "display": "Western Frisian"},
    {"code": "ga", "display": "Irish"},
    {"code": "gd", "display": "Scottish Gaelic"},
    {"code": "gl", "display": "Galician"},
    {"code": "gn", "display": "Guarani"},
    {"code": "gu", "display": "Gujarati"},
    {"code": "gv", "display": "Manx"},
    {"code": "ha", "display": "Hausa"},
    {"code": "he", "display": "Hebrew"},
    {"code": "hi", "display": "Hindi"},
    {"code": "ho", "display": "Hiri Motu"},
    {"code": "hr", "display": "Croatian"},
    {"code": "ht", "display": "Haitian"},
    {"code": "hu", "display": "Hungarian"},
    {"code": "hy", "display": "Armenian"},
    {"code": "hz", "display": "Herero"},
    {"code": "ia", "display": "Interlingua"},
    {"code": "id", "display": "Indonesian"},
    {"code": "ie", "display": "Interlingue"},
    {"code": "ig", "display": "Igbo"},
    {"code": "ii", "display": "Sichuan Yi"},
    {"code": "ik", "display": "Inupiaq"},
    {"code": "io", "display": "Ido"},
    {"code": "is", "display": "Icelandic"},
    {"code": "it", "display": "Italian"},
    {"code": "iu", "display": "Inuktitut"},
    {"code": "ja", "display": "Japanese"},
    {"code": "jv", "display": "Javanese"},
    {"code": "ka", "display": "Georgian"},
    {"code": "kg", "display": "Kongo"},
    {"code": "ki", "display": "Kikuyu"},
    {"code": "kj", "display": "Kuanyama"},
    {"code": "kk", "display": "Kazakh"},
    {"code": "kl", "display": "Kalaallisut"},
    {"code": "km", "display": "Central Khmer"},
    {"code": "kn", "display": "Kannada"},
    {"code": "ko", "display": "Korean"},
    {"code": "kr", "display": "Kanuri"},
    {"code": "ks", "display": "Kashmiri"},
    {"code": "ku", "display": "Kurdish"},
    {"code": "kv", "display": "Komi"},
    {"code": "kw", "display": "Cornish"},
    {"code": "ky", "display": "Kirghiz"},
    {"code": "la", "display": "Latin"},
    {"code": "lb", "display": "Luxembourgish"},
    {"code": "lg", "display": "Ganda"},
    {"code": "li", "display": "Limburgan"},
    {"code": "ln", "display": "Lingala"},
    {"code": "lo", "display": "Lao"},
    {"code": "lt", "display": "Lithuanian"},
    {"code": "lu", "display": "Luba-Katanga"},
    {"code": "lv", "display": "Latvian"},
    {"code": "mg", "display": "Malagasy"},
    {"code": "mh", "display": "Marshallese"},
    {"code": "mi", "display": "Maori"},
    {"code": "mk", "display": "Macedonian"},
    {"code": "ml", "display": "Malayalam"},
    {"code": "mn", "display": "Mongolian"},
    {"code": "mr", "display": "Marathi"},
    {"code": "ms", "display": "Malay"},
    {"code": "mt", "display": "Maltese"},
    {"code": "my", "display": "Burmese"},
    {"code": "na", "display": "Nauru"},
    {"code": "nb", "display": "Norwegian Bokmal"},
    {"code": "nd", "display": "North Ndebele"},
    {"code": "ne", "display": "Nepali"},
    {"code": "ng", "display": "Ndonga"},
    {"code": "nl", "display": "Dutch"},
    {"code": "nn", "display": "Norwegian Nynorsk"},
    {"code": "no", "display": "Norwegian"},
    {"code": "nr", "display": "South Ndebele"},
    {"code": "nv", "display": "Navajo"},
    {"code": "ny", "display": "Chichewa"},
    {"code": "oc", "display": "Occitan"},
    {"code": "oj", "display": "Ojibwa"},
    {"code": "om", "display": "Oromo"},
    {"code": "or", "display": "Oriya"},
    {"code": "os", "display": "Ossetian"},
    {"code": "pa", "display": "Panjabi"},
    {"code": "pi", "display": "Pali"},
    {"code": "pl", "display": "Polish"},
    {"code": "ps", "display": "Pushto"},
    {"code": "pt", "display": "Portuguese"},
    {"code": "qu", "display": "Quechua"},
    {"code": "rm", "display": "Romansh"},
    {"code": "rn", "display": "Rundi"},
    {"code": "ro", "display": "Romanian"},
    {"code": "ru", "display": "Russian"},
    {"code": "rw", "display": "Kinyarwanda"},
    {"code": "sa", "display": "Sanskrit"},
    {"code": "sc", "display": "Sardinian"},
    {"code": "sd", "display": "Sindhi"},
    {"code": "se", "display": "Northern Sami"},
    {"code": "sg", "display": "Sango"},
    {"code": "si", "display": "Sinhala"},
    {"code": "sk", "display": "Slovak"},
    {"code": "sl", "display": "Slovenian"},
    {"code": "sm", "display": "Samoan"},
    {"code": "sn", "display": "Shona"},
    {"code": "so", "display": "Somali"},
    {"code": "sq", "display": "Albanian"},
    {"code": "sr", "display": "Serbian"},
    {"code": "ss", "display": "Swati"},
    {"code": "st", "display": "Southern Sotho"},
    {"code": "su", "display": "Sundanese"},
    {"code": "sv", "display": "Swedish"},
    {"code": "sw", "display": "Swahili"},
    {"code": "ta", "display": "Tamil"},
    {"code": "te", "display": "Telugu"},
    {"code": "tg", "display": "Tajik"},
    {"code": "th", "display": "Thai"},
    {"code": "ti", "display": "Tigrinya"},
    {"code": "tk", "display": "Turkmen"},
    {"code": "tl", "display": "Tagalog"},
    {"code": "tn", "display": "Tswana"},
    {"code": "to", "display": "Tonga"},
    {"code": "tr", "display": "Turkish"},
    {"code": "ts", "display": "Tsonga"},
    {"code": "tt", "display": "Tatar"},
    {"code": "tw", "display": "Twi"},
    {"code": "ty", "display": "Tahitian"},
    {"code": "ug", "display": "Uighur"},
    {"code": "uk", "display": "Ukrainian"},
    {"code": "ur", "display": "Urdu"},
    {"code": "uz", "display": "Uzbek"},
    {"code": "ve", "display": "Venda"},
    {"code": "vi", "display": "Vietnamese"},
    {"code": "vo", "display": "Volapuk"},
    {"code": "wa", "display": "Walloon"},
    {"code": "wo", "display": "Wolof"},
    {"code": "xh", "display": "Xhosa"},
    {"code": "yi", "display": "Yiddish"},
    {"code": "yo", "display": "Yoruba"},
    {"code": "za", "display": "Zhuang"},
    {"code": "zh", "display": "Chinese"},
    {"code": "zu", "display": "Zulu"},
    {
      "code": "sgn",
      "display": "Sign Languages",
      "definition": "ISO 639-3 macrolanguage for sign languages"
    },
    {
      "code": "und",
      "display": "Undetermined",
      "definition": "Used when language cannot be determined"
    },
    {
      "code": "zxx",
      "display": "No linguistic content",
      "definition": "Used for non-linguistic content"
    }
  ]
}
