{
  "name": "ISO 4217 Currency Codes",
  "namespace": "urn:iso:std:iso:4217",
  "version": "2024",
  "source_url": "https://www.iso.org/iso-4217-currency-codes.html",
  "source_standard": "ISO 4217:2015",
  "last_updated": "2024-01-15",
  "domain": "core",
  "is_hierarchical": false,
  "codes": [
    {"code": "AED", "display": "UAE Dirham"},
    {"code": "AFN", "display": "Afghani"},
    {"code": "ALL", "display": "Lek"},
    {"code": "AMD", "display": "Armenian Dram"},
    {"code": "ANG", "display": "Netherlands Antillean Guilder"},
    {"code": "AOA", "display": "Kwanza"},
    {"code": "ARS", "display": "Argentine Peso"},
    {"code": "AUD", "display": "Australian Dollar"},
    {"code": "AWG", "display": "Aruban Florin"},
    {"code": "AZN", "display": "Azerbaijan Manat"},
    {"code": "BAM", "display": "Convertible Mark"},
    {"code": "BBD", "display": "Barbados Dollar"},
    {"code": "BDT", "display": "Taka"},
    {"code": "BGN", "display": "Bulgarian Lev"},
    {"code": "BHD", "display": "Bahraini Dinar"},
    {"code": "BIF", "display": "Burundi Franc"},
    {"code": "BMD", "display": "Bermudian Dollar"},
    {"code": "BND", "display": "Brunei Dollar"},
    {"code": "BOB", "display": "Boliviano"},
    {"code": "BRL", "display": "Brazilian Real"},
    {"code": "BSD", "display": "Bahamian Dollar"},
    {"code": "BTN", "display": "Ngultrum"},
    {"code": "BWP", "display": "Pula"},
    {"code": "BYN", "display": "Belarusian Ruble"},
    {"code": "BZD", "display": "Belize Dollar"},
    {"code": "CAD", "display": "Canadian Dollar"},
    {"code": "CDF", "display": "Congolese Franc"},
    {"code": "CHF", "display": "Swiss Franc"},
    {"code": "CLP", "display": "Chilean Peso"},
    {"code": "CNY", "display": "Yuan Renminbi"},
    {"code": "COP", "display": "Colombian Peso"},
    {"code": "CRC", "display": "Costa Rican Colon"},
    {"code": "CUP", "display": "Cuban Peso"},
    {"code": "CVE", "display": "Cabo Verde Escudo"},
    {"code": "CZK", "display": "Czech Koruna"},
    {"code": "DJF", "display": "Djibouti Franc"},
    {"code": "DKK", "display": "Danish Krone"},
    {"code": "DOP", "display": "Dominican Peso"},
    {"code": "DZD", "display": "Algerian Dinar"},
    {"code": "EGP", "display": "Egyptian Pound"},
    {"code": "ERN", "display": "Nakfa"},
    {"code": "ETB", "display": "Ethiopian Birr"},
    {"code": "EUR", "display": "Euro"},
    {"code": "FJD", "display": "Fiji Dollar"},
    {"code": "FKP", "display": "Falkland Islands Pound"},
    {"code": "GBP", "display": "Pound Sterling"},
    {"code": "GEL", "display": "Lari"},
    {"code": "GHS", "display": "Ghana Cedi"},
    {"code": "GIP", "display": "Gibraltar Pound"},
    {"code": "GMD", "display": "Dalasi"},
    {"code": "GNF", "display": "Guinean Franc"},
    {"code": "GTQ", "display": "Quetzal"},
    {"code": "GYD", "display": "Guyana Dollar"},
    {"code": "HKD", "display": "Hong Kong Dollar"},
    {"code": "HNL", "display": "Lempira"},
    {"code": "HTG", "display": "Gourde"},
    {"code": "HUF", "display": "Forint"},
    {"code": "IDR", "display": "Rupiah"},
    {"code": "ILS", "display": "New Israeli Sheqel"},
    {"code": "INR", "display": "Indian Rupee"},
    {"code": "IQD", "display": "Iraqi Dinar"},
    {"code": "IRR", "display": "Iranian Rial"},
    {"code": "ISK", "display": "Iceland Krona"},
    {"code": "JMD", "display": "Jamaican Dollar"},
    {"code": "JOD", "display": "Jordanian Dinar"},
    {"code": "JPY", "display": "Yen"},
    {"code": "KES", "display": "Kenyan Shilling"},
    {"code": "KGS", "display": "Som"},
    {"code": "KHR", "display": "Riel"},
    {"code": "KMF", "display": "Comorian Franc"},
    {"code": "KPW", "display": "North Korean Won"},
    {"code": "KRW", "display": "Won"},
    {"code": "KWD", "display": "Kuwaiti Dinar"},
    {"code": "KYD", "display": "Cayman Islands Dollar"},
    {"code": "KZT", "display": "Tenge"},
    {"code": "LAK", "display": "Lao Kip"},
    {"code": "LBP", "display": "Lebanese Pound"},
    {"code": "LKR", "display": "Sri Lanka Rupee"},
    {"code": "LRD", "display": "Liberian Dollar"},
    {"code": "LSL", "display": "Loti"},
    {"code": "LYD", "display": "Libyan Dinar"},
    {"code": "MAD", "display": "Moroccan Dirham"},
    {"code": "MDL", "display": "Moldovan Leu"},
    {"code": "MGA", "display": "Malagasy Ariary"},
    {"code": "MKD", "display": "Denar"},
    {"code": "MMK", "display": "Kyat"},
    {"code": "MNT", "display": "Tugrik"},
    {"code": "MOP", "display": "Pataca"},
    {"code": "MRU", "display": "Ouguiya"},
    {"code": "MUR", "display": "Mauritius Rupee"},
    {"code": "MVR", "display": "Rufiyaa"},
    {"code": "MWK", "display": "Malawi Kwacha"},
    {"code": "MXN", "display": "Mexican Peso"},
    {"code": "MYR", "display": "Malaysian Ringgit"},
    {"code": "MZN", "display": "Mozambique Metical"},
    {"code": "NAD", "display": "Namibia Dollar"},
    {"code": "NGN", "display": "Naira"},
    {"code": "NIO", "display": "Cordoba Oro"},
    {"code": "NOK", "display": "Norwegian Krone"},
    {"code": "NPR", "display": "Nepalese Rupee"},
    {"code": "NZD", "display": "New Zealand Dollar"},
    {"code": "OMR", "display": "Rial Omani"},
    {"code": "PAB", "display": "Balboa"},
    {"code": "PEN", "display": "Sol"},
    {"code": "PGK", "display": "Kina"},
    {"code": "PHP", "display": "Philippine Peso"},
    {"code": "PKR", "display": "Pakistan Rupee"},
    {"code": "PLN", "display": "Zloty"},
    {"code": "PYG", "display": "Guarani"},
    {"code": "QAR", "display": "Qatari Rial"},
    {"code": "RON", "display": "Romanian Leu"},
    {"code": "RSD", "display": "Serbian Dinar"},
    {"code": "RUB", "display": "Russian Ruble"},
    {"code": "RWF", "display": "Rwanda Franc"},
    {"code": "SAR", "display": "Saudi Riyal"},
    {"code": "SBD", "display": "Solomon Islands Dollar"},
    {"code": "SCR", "display": "Seychelles Rupee"},
    {"code": "SDG", "display": "Sudanese Pound"},
    {"code": "SEK", "display": "Swedish Krona"},
    {"code": "SGD", "display": "Singapore Dollar"},
    {"code": "SHP", "display": "Saint Helena Pound"},
    {"code": "SLE", "display": "Leone"},
    {"code": "SOS", "display": "Somali Shilling"},
    {"code": "SRD", "display": "Surinam Dollar"},
    {"code": "SSP", "display": "South Sudanese Pound"},
    {"code": "STN", "display": "Dobra"},
    {"code": "SVC", "display": "El Salvador Colon"},
    {"code": "SYP", "display": "Syrian Pound"},
    {"code": "SZL", "display": "Lilangeni"},
    {"code": "THB", "display": "Baht"},
    {"code": "TJS", "display": "Somoni"},
    {"code": "TMT", "display": "Turkmenistan New Manat"},
    {"code": "TND", "display": "Tunisian Dinar"},
    {"code": "TOP", "display": "Pa'anga"},
    {"code": "TRY", "display": "Turkish Lira"},
    {"code": "TTD", "display": "Trinidad and Tobago Dollar"},
    {"code": "TWD", "display": "New Taiwan Dollar"},
    {"code": "TZS", "display": "Tanzanian Shilling"},
    {"code": "UAH", "display": "Hryvnia"},
    {"code": "UGX", "display": "Uganda Shilling"},
    {"code": "USD", "display": "US Dollar"},
    {"code": "UYU", "display": "Peso Uruguayo"},
    {"code": "UZS", "display": "Uzbekistan Sum"},
    {"code": "VES", "display": "Bolivar Soberano"},
    {"code": "VND", "display": "Dong"},
    {"code": "VUV", "display": "Vatu"},
    {"code": "WST", "display": "Tala"},
    {"code": "XAF", "display": "CFA Franc BEAC"},
    {"code": "XCD", "display": "East Caribbean Dollar"},
    {"code": "XOF", "display": "CFA Franc BCEAO"},
    {"code": "XPF", "display": "CFP Franc"},
    {"code": "YER", "display": "Yemeni Rial"},
    {"code": "ZAR", "display": "Rand"},
    {"code": "ZMW", "display": "Zambian Kwacha"},
    {"code": "ZWL", "display": "Zimbabwe Dollar"},
    {"code": "XXX", "display": "No currency", "definition": "Used when no currency is involved"}
  ]
}
