{
  "name": "Washington Group Difficulty Severity Levels",
  "namespace": "urn:washingtongroup:severity",
  "version": "2022",
  "source_url": "https://www.washingtongroup-disability.com/question-sets/wg-short-set-on-functioning-wg-ss/",
  "source_standard": "WG-SS (Washington Group Short Set)",
  "last_updated": "2024-01-15",
  "domain": "core",
  "is_hierarchical": false,
  "codes": [
    {
      "code": "1",
      "display": "No difficulty",
      "definition": "No difficulty performing the activity"
    },
    {
      "code": "2",
      "display": "Some difficulty",
      "definition": "Some difficulty performing the activity"
    },
    {
      "code": "3",
      "display": "A lot of difficulty",
      "definition": "A lot of difficulty performing the activity"
    },
    {
      "code": "4",
      "display": "Cannot do at all",
      "definition": "Cannot perform the activity at all"
    }
  ]
}
